commit	val_bpb	memory_gb	status	description
a1b2c3d	1.0980	44.0	keep	baseline: depth=6 full attention batch=131K warmdown=0.5 LR_floor=0
b2c3d4e	1.1017	44.5	discard	increase depth from 6 to 8
c3d4e5f	1.0961	44.2	keep	switch window pattern from L to SSSL (sliding window attention)
d4e5f6g	1.0990	45.0	discard	depth 8 with SSSL pattern
